<!ELEMENT listado (futuro+, divisa+, bono+, letra+)>
<!ELEMENT futuro (producto, mercado?, ciudad_procedencia)>
    <!ATTLIST futuro precio CDATA #REQUIRED>
<!ELEMENT divisa (nombre_divisa, tipo_de_cambio+, ciudad_procedencia)>
    <!ATTLIST divisa precio CDATA #REQUIRED>
    <!ATTLIST divisa estable (si|no) #IMPLIED>
<!ELEMENT bono (pais_de_procedencia, valor_deseado, valor_minimo, valor_maximo, ciudad_procedencia)>
    <!ATTLIST bono precio CDATA #REQUIRED>
    <!ATTLIST bono estable (si|no) #IMPLIED>
<!ELEMENT letra (tipo_de_interes, pais_emisor, ciudad_procedencia)>
    <!ATTLIST letra precio CDATA #REQUIRED>
<!ELEMENT pais_emisor ((espa침a | eeuu)|(alemania | jap칩n))>
<!ELEMENT espa침a EMPTY>
<!ELEMENT eeuu EMPTY>
<!ELEMENT alemania EMPTY>
<!ELEMENT jap칩n EMPTY>
<!ELEMENT ciudad_procedencia ((madrid | nueva_york)|(frankfurt | tokio))>
<!ELEMENT madrid EMPTY>
<!ELEMENT nueva_york EMPTY>
<!ELEMENT frankfurt EMPTY>
<!ELEMENT tokio EMPTY>
<!ELEMENT producto (#PCDATA)>
<!ELEMENT mercado (#PCDATA)>
<!ELEMENT nombre_divisa (#PCDATA)>
<!ELEMENT tipo_de_cambio (#PCDATA)>
<!ELEMENT pais_de_procedencia (#PCDATA)>
<!ELEMENT valor_deseado (#PCDATA)>
<!ELEMENT valor_minimo (#PCDATA)>
<!ELEMENT valor_maximo (#PCDATA)>
<!ELEMENT tipo_de_interes (#PCDATA)>